Sheet: Sheet2
G1: Number of Units: | H1: 4 | N1: of:=SUM([.N5:.N40]) -> 37.8100653333333 | Q1: of:=SUM([.Q4:.Q45]) -> 267.087688888889 | S1: of:=SUM([.S4:.S45]) -> 0
B3: Line Item | C3: Manufacturer | D3: MPN | E3: Octopart URL | F3: Schematic Reference | G3: Description | H3: Item Qty | I3: Order multiple | J3: Package | K3: Package price | L3: Postage | M3: Per Item Cost | N3: Unit Cost | O3: MOQ | P3: Remainder | Q3: Order price | R3: Paid? | S3: Outstanding Cost
S4: of:=IF([.R4]="Y"; 0; [.Q4]) -> 0
B5: UWX1C100MCL1GB | C5: Nichicon | D5: UWX1C100MCL1GB | E5: https://octopart.com/uwx1c100mcl1gb-nichicon-203107 | F5: C1 | G5: 10µF electrolytic capacitor | H5: 1 | I5: 10 | J5: Cut tape | K5: of:=[.I5]*0.106*1.2 -> 1.272 | L5: 0 | M5: of:=([.L5]+[.K5])/[.I5] -> 0.1272 | N5: of:=[.M5]*[.H5] -> 0.1272 | O5: of:=ROUNDUP([.$H$1]*[.H5]/[.I5]) -> 1 | P5: of:=([.I5]*[.O5])-([.H5]*[.$H$1]) -> 6 | Q5: of:=[.O5]*([.L5]+[.K5]) -> 1.272 | R5: Y | S5: of:=IF([.R5]="Y"; 0; [.Q5]) -> 0
B6: MC0805B104K500CT | C6: Multicomp | D6: MC0805B104K500CT | E6: https://octopart.com/mc0805b104k500ct-multicomp-10529614 | F6: C2, C5, C6 | G6: 0.1µF 0805 Capacitor | H6: 3 | I6: 150 | J6: Cut tape | K6: of:=[.I6]*0.0094*1.2 -> 1.692 | L6: 0 | M6: of:=([.L6]+[.K6])/[.I6] -> 0.01128 | N6: of:=[.M6]*[.H6] -> 0.03384 | O6: of:=ROUNDUP([.$H$1]*[.H6]/[.I6]) -> 1 | P6: of:=([.I6]*[.O6])-([.H6]*[.$H$1]) -> 138 | Q6: of:=[.O6]*([.L6]+[.K6]) -> 1.692 | R6: Y | S6: of:=IF([.R6]="Y"; 0; [.Q6]) -> 0
B7: MC1206B105K500CT | C7: Multicomp | D7: MC1206B105K500CT | E7: https://octopart.com/mc1206b105k500ct-multicomp-10529438 | F7: C3, C4 | G7: 1µF 1206 Capacitor | H7: 2 | I7: 15 | J7: Cut tape | K7: of:=[.I7]*0.0913*1.2 -> 1.6434 | L7: 0 | M7: of:=([.L7]+[.K7])/[.I7] -> 0.10956 | N7: of:=[.M7]*[.H7] -> 0.21912 | O7: of:=ROUNDUP([.$H$1]*[.H7]/[.I7]) -> 1 | P7: of:=([.I7]*[.O7])-([.H7]*[.$H$1]) -> 7 | Q7: of:=[.O7]*([.L7]+[.K7]) -> 1.6434 | R7: Y | S7: of:=IF([.R7]="Y"; 0; [.Q7]) -> 0
B8: MC0603N220K500CT | C8: Multicomp | D8: MC0603N220K500CT | E8: https://octopart.com/mc0603n220k500ct-multicomp-10530022 | F8: C7, C8 | G8: 22pF 0603 Capacitor | H8: 2 | I8: 25 | J8: Cut tape | K8: of:=[.I8]*1.2*0.00438 -> 0.1314 | L8: 0 | M8: of:=([.L8]+[.K8])/[.I8] -> 0.005256 | N8: of:=[.M8]*[.H8] -> 0.010512 | O8: of:=ROUNDUP([.$H$1]*[.H8]/[.I8]) -> 1 | P8: of:=([.I8]*[.O8])-([.H8]*[.$H$1]) -> 17 | Q8: of:=[.O8]*([.L8]+[.K8]) -> 0.1314 | R8: Y | S8: of:=IF([.R8]="Y"; 0; [.Q8]) -> 0
B9: SML-LX1206SRW-TR | C9: Lumex | D9: SML-LX1206SRW-TR | E9: https://octopart.com/sml-lx1206srw-tr-lumex-550942 | F9: D1 | G9: Red 1206 LED | H9: 1 | I9: 10 | J9: Cut tape | K9: of:=[.I9]*1.2*0.058 -> 0.696 | L9: 0 | M9: of:=([.L9]+[.K9])/[.I9] -> 0.0696 | N9: of:=[.M9]*[.H9] -> 0.0696 | O9: of:=ROUNDUP([.$H$1]*[.H9]/[.I9]) -> 1 | P9: of:=([.I9]*[.O9])-([.H9]*[.$H$1]) -> 6 | Q9: of:=[.O9]*([.L9]+[.K9]) -> 0.696 | R9: Y | S9: of:=IF([.R9]="Y"; 0; [.Q9]) -> 0
B10: TC1108-3.3VDBTR | C10: Microchip | D10: TC1108-3.3VDBTR | E10: https://octopart.com/tc1108-3.3vdbtr-microchip-540426 | F10: I1 | G10: 3.3V low dropout, linear regulator | H10: 1 | I10: 8 | J10: Cut tape | K10: of:=[.I10]*1.2*0.3875 -> 3.72 | L10: 0 | M10: of:=([.L10]+[.K10])/[.I10] -> 0.465 | N10: of:=[.M10]*[.H10] -> 0.465 | O10: of:=ROUNDUP([.$H$1]*[.H10]/[.I10]) -> 1 | P10: of:=([.I10]*[.O10])-([.H10]*[.$H$1]) -> 4 | Q10: of:=[.O10]*([.L10]+[.K10]) -> 3.72 | R10: Y | S10: of:=IF([.R10]="Y"; 0; [.Q10]) -> 0
B11: ATMEGA328P-PU | C11: Atmel | D11: ATMEGA328P-PU | E11: https://octopart.com/atmega328p-pu-atmel-42866773 | F11: IC1 | G11: Push fit into socket | H11: 1 | I11: 8 | J11: Loose | K11: of:=[.I11]*1.2*2.35 -> 22.56 | L11: 0 | M11: of:=([.L11]+[.K11])/[.I11] -> 2.82 | N11: of:=[.M11]*[.H11] -> 2.82 | O11: of:=ROUNDUP([.$H$1]*[.H11]/[.I11]) -> 1 | P11: of:=([.I11]*[.O11])-([.H11]*[.$H$1]) -> 4 | Q11: of:=[.O11]*([.L11]+[.K11]) -> 22.56 | R11: Y | S11: of:=IF([.R11]="Y"; 0; [.Q11]) -> 0
B12: 1-2199298-9 | C12: TE Connectivity | D12: 1-2199298-9 | E12: https://octopart.com/1-2199298-9-te+connectivity-39188588 | F12: IC1 | G12: DIP-28 Socket (solder to board) | H12: 1 | I12: 10 | J12: Loose | K12: of:=[.I12]*1.2*0.422 -> 5.064 | L12: 0 | M12: of:=([.L12]+[.K12])/[.I12] -> 0.5064 | N12: of:=[.M12]*[.H12] -> 0.5064 | O12: of:=ROUNDUP([.$H$1]*[.H12]/[.I12]) -> 1 | P12: of:=([.I12]*[.O12])-([.H12]*[.$H$1]) -> 6 | Q12: of:=[.O12]*([.L12]+[.K12]) -> 5.064 | R12: Y | S12: of:=IF([.R12]="Y"; 0; [.Q12]) -> 0
B13: RFM69HW-868S2 | C13: RF Solutions | D13: RFM69HW-868S2 | E13: https://octopart.com/rfm69hw-868s2-rf+solutions-52732388 | F13: IC2 | G13: 868MHz High output, packet radio module | H13: 1 | I13: 8 | J13: Loose | K13: of:=[.I13]*1.2*6.62 -> 63.552 | L13: 0 | M13: of:=([.L13]+[.K13])/[.I13] -> 7.944 | N13: of:=[.M13]*[.H13] -> 7.944 | O13: of:=ROUNDUP([.$H$1]*[.H13]/[.I13]) -> 1 | P13: of:=([.I13]*[.O13])-([.H13]*[.$H$1]) -> 4 | Q13: of:=[.O13]*([.L13]+[.K13]) -> 63.552 | R13: Y | S13: of:=IF([.R13]="Y"; 0; [.Q13]) -> 0
B14: REF-182665-03 | E14: http://www.toby.co.uk/content/catalogue/products.aspx?series=REF-1826xx-0x | F14: J1 | G14: 40-pin surface mount, through hole header socket | H14: 1 | I14: 10 | J14: Loose | K14: of:=[.I14]*1.2*0.57 -> 6.84 | L14: 0 | M14: of:=([.L14]+[.K14])/[.I14] -> 0.684 | N14: of:=[.M14]*[.H14] -> 0.684 | O14: of:=ROUNDUP([.$H$1]*[.H14]/[.I14]) -> 1 | P14: of:=([.I14]*[.O14])-([.H14]*[.$H$1]) -> 6 | Q14: of:=[.O14]*([.L14]+[.K14]) -> 6.84 | R14: Y | S14: of:=IF([.R14]="Y"; 0; [.Q14]) -> 0
B15: M20-9992046 | C15: Harwin | D15: M20-9992046 | E15: https://octopart.com/m20-9992046-harwin-2627752 | F15: P1, P3, P4 | G15: 1 part split over 3 positions | H15: 1 | I15: 10 | J15: Loose | K15: of:=[.I15]*1.2*0.328 -> 3.936 | L15: 0 | M15: of:=([.L15]+[.K15])/[.I15] -> 0.3936 | N15: of:=[.M15]*[.H15] -> 0.3936 | O15: of:=ROUNDUP([.$H$1]*[.H15]/[.I15]) -> 1 | P15: of:=([.I15]*[.O15])-([.H15]*[.$H$1]) -> 6 | Q15: of:=[.O15]*([.L15]+[.K15]) -> 3.936 | R15: Y | S15: of:=IF([.R15]="Y"; 0; [.Q15]) -> 0
B16: BSS138 | C16: Fairchild Semiconductor | D16: BSS138 | E16: https://octopart.com/bss138-fairchild+semiconductor-13127972 | F16: Q1 | G16: N-channel MOSFET | H16: 1 | I16: 10 | J16: Cut tape | K16: of:=[.I16]*1.2*0.11 -> 1.32 | L16: 0 | M16: of:=([.L16]+[.K16])/[.I16] -> 0.132 | N16: of:=[.M16]*[.H16] -> 0.132 | O16: of:=ROUNDUP([.$H$1]*[.H16]/[.I16]) -> 1 | P16: of:=([.I16]*[.O16])-([.H16]*[.$H$1]) -> 6 | Q16: of:=[.O16]*([.L16]+[.K16]) -> 1.32 | R16: Y | S16: of:=IF([.R16]="Y"; 0; [.Q16]) -> 0
B17: MCWR08X1002FTL | C17: Multicomp | D17: MCWR08X1002FTL | E17: https://octopart.com/mcwr08x1002ftl-multicomp-50550529 | F17: R1, R2, R4, R5 | G17: 10Kohm 0805 resistor | H17: 4 | I17: 50 | J17: Cut tape | K17: of:=[.I17]*1.2*0.002 -> 0.12 | L17: 0 | M17: of:=([.L17]+[.K17])/[.I17] -> 0.0024 | N17: of:=[.M17]*[.H17] -> 0.0096 | O17: of:=ROUNDUP([.$H$1]*[.H17]/[.I17]) -> 1 | P17: of:=([.I17]*[.O17])-([.H17]*[.$H$1]) -> 34 | Q17: of:=[.O17]*([.L17]+[.K17]) -> 0.12 | R17: Y | S17: of:=IF([.R17]="Y"; 0; [.Q17]) -> 0
B18: CRGH0603J75R | C18: TE Connectivity | D18: CRGH0603J75R | E18: https://octopart.com/crgh0603j75r-te+connectivity-24382109 | F18: R3 | G18: 75ohm 0603 resistor | H18: 1 | I18: 150 | J18: Cut tape | K18: of:=[.I18]*1.2*0.0036 -> 0.648 | L18: 0 | M18: of:=([.L18]+[.K18])/[.I18] -> 0.00432 | N18: of:=[.M18]*[.H18] -> 0.00432 | O18: of:=ROUNDUP([.$H$1]*[.H18]/[.I18]) -> 1 | P18: of:=([.I18]*[.O18])-([.H18]*[.$H$1]) -> 146 | Q18: of:=[.O18]*([.L18]+[.K18]) -> 0.648 | R18: Y | S18: of:=IF([.R18]="Y"; 0; [.Q18]) -> 0
B19: KSEK43GLFS | C19: C&K Components | D19: KSEK43G LFS | E19: https://octopart.com/ksek43g+lfs-c%26k+components-33963906 | F19: SW1 | G19: Tactile pushbutton switch | H19: 1 | I19: 10 | J19: Cut tape | K19: of:=[.I19]*1.2*0.12 -> 1.44 | L19: 0 | M19: of:=([.L19]+[.K19])/[.I19] -> 0.144 | N19: of:=[.M19]*[.H19] -> 0.144 | O19: of:=ROUNDUP([.$H$1]*[.H19]/[.I19]) -> 1 | P19: of:=([.I19]*[.O19])-([.H19]*[.$H$1]) -> 6 | Q19: of:=[.O19]*([.L19]+[.K19]) -> 1.44 | R19: Y | S19: of:=IF([.R19]="Y"; 0; [.Q19]) -> 0
B20: MCRSD16000F183000RR | C20: Multicomp | D20: MCRSD16000F183000RR | E20: https://octopart.com/mcrsd16000f183000rr-multicomp-10528717 | F20: Y1 | G20: 16MHz crystal resonator | H20: 1 | I20: 10 | J20: Loose | K20: of:=[.I20]*1.2*0.169 -> 2.028 | L20: 0 | M20: of:=([.L20]+[.K20])/[.I20] -> 0.2028 | N20: of:=[.M20]*[.H20] -> 0.2028 | O20: of:=ROUNDUP([.$H$1]*[.H20]/[.I20]) -> 1 | P20: of:=([.I20]*[.O20])-([.H20]*[.$H$1]) -> 6 | Q20: of:=[.O20]*([.L20]+[.K20]) -> 2.028 | R20: Y | S20: of:=IF([.R20]="Y"; 0; [.Q20]) -> 0
B21: 2254056 | C21: Ettinger | D21: 07.02.605 | E21: https://octopart.com/07.02.605-ettinger-25948966 | G21: 5mm Spacer sleeve | H21: 4 | I21: 20 | J21: Loose | K21: of:=[.I21]*1.2*0.093 -> 2.232 | L21: 0 | M21: of:=([.L21]+[.K21])/[.I21] -> 0.1116 | N21: of:=[.M21]*[.H21] -> 0.4464 | O21: of:=ROUNDUP([.$H$1]*[.H21]/[.I21]) -> 1 | P21: of:=([.I21]*[.O21])-([.H21]*[.$H$1]) -> 4 | Q21: of:=[.O21]*([.L21]+[.K21]) -> 2.232 | R21: Y | S21: of:=IF([.R21]="Y"; 0; [.Q21]) -> 0
B22: 2494583 | C22: Ettinger | D22: 05.12.113 | E22: https://octopart.com/05.12.113-ettinger-65485457 | G22: M2.5 11mm Standoff | H22: 4 | I22: 10 | J22: Loose | K22: of:=[.I22]*1.2*0.241 -> 2.892 | L22: 0 | M22: of:=([.L22]+[.K22])/[.I22] -> 0.2892 | N22: of:=[.M22]*[.H22] -> 1.1568 | O22: of:=ROUNDUP([.$H$1]*[.H22]/[.I22]) -> 2 | P22: of:=([.I22]*[.O22])-([.H22]*[.$H$1]) -> 4 | Q22: of:=[.O22]*([.L22]+[.K22]) -> 5.784 | R22: Y | S22: of:=IF([.R22]="Y"; 0; [.Q22]) -> 0
B23: nylon M2.5 12mm | G23: M2.5×12 nylon screw | H23: 4 | I23: 50 | J23: Loose | K23: of:=(3.57+1.85+3.99) -> 9.41 | L23: 0 | M23: of:=([.L23]+[.K23])/[.I23] -> 0.1882 | N23: of:=[.M23]*[.H23] -> 0.7528 | O23: of:=ROUNDUP([.$H$1]*[.H23]/[.I23]) -> 1 | P23: of:=([.I23]*[.O23])-([.H23]*[.$H$1]) -> 34 | Q23: of:=[.O23]*([.L23]+[.K23]) -> 9.41 | R23: Y | S23: of:=IF([.R23]="Y"; 0; [.Q23]) -> 0
B24: nylon nut M2.5 | G24: M2.5 Nylon nut | H24: 1 | I24: 50 | J24: Loose | K24: 3.95 | L24: 0 | M24: of:=([.L24]+[.K24])/[.I24] -> 0.079 | N24: of:=[.M24]*[.H24] -> 0.079 | O24: of:=ROUNDUP([.$H$1]*[.H24]/[.I24]) -> 1 | P24: of:=([.I24]*[.O24])-([.H24]*[.$H$1]) -> 46 | Q24: of:=[.O24]*([.L24]+[.K24]) -> 3.95 | R24: Y | S24: of:=IF([.R24]="Y"; 0; [.Q24]) -> 0
B25: nylon washer M2.5 | G25: M2.5 Nylon Washer | H25: 1 | I25: 50 | J25: Loose | K25: 1.8 | L25: 0 | M25: of:=([.L25]+[.K25])/[.I25] -> 0.036 | N25: of:=[.M25]*[.H25] -> 0.036 | O25: of:=ROUNDUP([.$H$1]*[.H25]/[.I25]) -> 1 | P25: of:=([.I25]*[.O25])-([.H25]*[.$H$1]) -> 46 | Q25: of:=[.O25]*([.L25]+[.K25]) -> 1.8 | R25: Y | S25: of:=IF([.R25]="Y"; 0; [.Q25]) -> 0
B26: Brown Base | C26: DefProc | H26: 1 | I26: 4 | J26: 300×300 sheet | K26: of:=3.49*1.2 -> 4.188 | L26: of:=8.95/9 -> 0.994444444444444 | M26: of:=([.L26]+[.K26])/[.I26] -> 1.29561111111111 | N26: of:=[.M26]*[.H26] -> 1.29561111111111 | O26: of:=ROUNDUP([.$H$1]*[.H26]/[.I26]) -> 1 | P26: of:=([.I26]*[.O26])-([.H26]*[.$H$1]) -> 0 | Q26: of:=[.O26]*([.L26]+[.K26]) -> 5.18244444444444 | R26: Y | S26: of:=IF([.R26]="Y"; 0; [.Q26]) -> 0
B27: Left/right side | C27: DefProc | H27: 2 | I27: 4 | J27: 300×300 sheet | K27: of:=3.49*1.2 -> 4.188 | L27: of:=8.95/9 -> 0.994444444444444 | M27: of:=([.L27]+[.K27])/[.I27] -> 1.29561111111111 | N27: of:=[.M27]*[.H27] -> 2.59122222222222 | O27: of:=ROUNDUP([.$H$1]*[.H27]/[.I27]) -> 2 | P27: of:=([.I27]*[.O27])-([.H27]*[.$H$1]) -> 0 | Q27: of:=[.O27]*([.L27]+[.K27]) -> 10.3648888888889 | R27: Y | S27: of:=IF([.R27]="Y"; 0; [.Q27]) -> 0
B28: Front/back side | C28: DefProc | H28: 2 | I28: 4 | J28: 300×300 sheet | K28: of:=3.49*1.2 -> 4.188 | L28: of:=8.95/9 -> 0.994444444444444 | M28: of:=([.L28]+[.K28])/[.I28] -> 1.29561111111111 | N28: of:=[.M28]*[.H28] -> 2.59122222222222 | O28: of:=ROUNDUP([.$H$1]*[.H28]/[.I28]) -> 2 | P28: of:=([.I28]*[.O28])-([.H28]*[.$H$1]) -> 0 | Q28: of:=[.O28]*([.L28]+[.K28]) -> 10.3648888888889 | R28: Y | S28: of:=IF([.R28]="Y"; 0; [.Q28]) -> 0
B29: Green top | C29: DefProc | H29: 1 | I29: 4 | J29: 300×300 sheet | K29: of:=3.49*1.2 -> 4.188 | L29: of:=8.95/9 -> 0.994444444444444 | M29: of:=([.L29]+[.K29])/[.I29] -> 1.29561111111111 | N29: of:=[.M29]*[.H29] -> 1.29561111111111 | O29: of:=ROUNDUP([.$H$1]*[.H29]/[.I29]) -> 1 | P29: of:=([.I29]*[.O29])-([.H29]*[.$H$1]) -> 0 | Q29: of:=[.O29]*([.L29]+[.K29]) -> 5.18244444444444 | R29: Y | S29: of:=IF([.R29]="Y"; 0; [.Q29]) -> 0
B30: Dk green squares | C30: DefProc | H30: 12 | I30: 400 | J30: 300×300 sheet | K30: of:=3.49*1.2 -> 4.188 | L30: of:=8.95/9 -> 0.994444444444444 | M30: of:=([.L30]+[.K30])/[.I30] -> 0.0129561111111111 | N30: of:=[.M30]*[.H30] -> 0.155473333333333 | O30: of:=ROUNDUP([.$H$1]*[.H30]/[.I30]) -> 1 | P30: of:=([.I30]*[.O30])-([.H30]*[.$H$1]) -> 352 | Q30: of:=[.O30]*([.L30]+[.K30]) -> 5.18244444444444 | R30: Y | S30: of:=IF([.R30]="Y"; 0; [.Q30]) -> 0
B31: Lt green squares | C31: DefProc | H31: 12 | I31: 400 | J31: 300×300 sheet | K31: of:=3.49*1.2 -> 4.188 | L31: of:=8.95/9 -> 0.994444444444444 | M31: of:=([.L31]+[.K31])/[.I31] -> 0.0129561111111111 | N31: of:=[.M31]*[.H31] -> 0.155473333333333 | O31: of:=ROUNDUP([.$H$1]*[.H31]/[.I31]) -> 1 | P31: of:=([.I31]*[.O31])-([.H31]*[.$H$1]) -> 352 | Q31: of:=[.O31]*([.L31]+[.K31]) -> 5.18244444444444 | R31: Y | S31: of:=IF([.R31]="Y"; 0; [.Q31]) -> 0
B32: Lt brown squares | C32: DefProc | H32: of:=12*4 -> 48 | I32: 400 | J32: 300×300 sheet | K32: of:=3.49*1.2 -> 4.188 | L32: of:=8.95/9 -> 0.994444444444444 | M32: of:=([.L32]+[.K32])/[.I32] -> 0.0129561111111111 | N32: of:=[.M32]*[.H32] -> 0.621893333333333 | O32: of:=ROUNDUP([.$H$1]*[.H32]/[.I32]) -> 1 | P32: of:=([.I32]*[.O32])-([.H32]*[.$H$1]) -> 208 | Q32: of:=[.O32]*([.L32]+[.K32]) -> 5.18244444444444 | R32: Y | S32: of:=IF([.R32]="Y"; 0; [.Q32]) -> 0
B33: Brown squares | C33: DefProc | H33: 20 | I33: 400 | J33: 300×300 sheet | K33: of:=3.49*1.2 -> 4.188 | L33: of:=8.95/9 -> 0.994444444444444 | M33: of:=([.L33]+[.K33])/[.I33] -> 0.0129561111111111 | N33: of:=[.M33]*[.H33] -> 0.259122222222222 | O33: of:=ROUNDUP([.$H$1]*[.H33]/[.I33]) -> 1 | P33: of:=([.I33]*[.O33])-([.H33]*[.$H$1]) -> 320 | Q33: of:=[.O33]*([.L33]+[.K33]) -> 5.18244444444444 | R33: Y | S33: of:=IF([.R33]="Y"; 0; [.Q33]) -> 0
B34: Grey squares | C34: DefProc | H34: 8 | I34: 200 | J34: 150×300 sheet | K34: of:=2*1.2 -> 2.4 | L34: of:=8.95/9 -> 0.994444444444444 | M34: of:=([.L34]+[.K34])/[.I34] -> 0.0169722222222222 | N34: of:=[.M34]*[.H34] -> 0.135777777777778 | O34: of:=ROUNDUP([.$H$1]*[.H34]/[.I34]) -> 1 | P34: of:=([.I34]*[.O34])-([.H34]*[.$H$1]) -> 168 | Q34: of:=[.O34]*([.L34]+[.K34]) -> 3.39444444444444 | R34: Y | S34: of:=IF([.R34]="Y"; 0; [.Q34]) -> 0
B35: Circuit board | C35: Ragworm | H35: 1 | I35: 6 | K35: 58.03 | L35: 0 | M35: of:=([.L35]+[.K35])/[.I35] -> 9.67166666666667 | N35: of:=[.M35]*[.H35] -> 9.67166666666667 | O35: of:=ROUNDUP([.$H$1]*[.H35]/[.I35]) -> 1 | P35: of:=([.I35]*[.O35])-([.H35]*[.$H$1]) -> 2 | Q35: of:=[.O35]*([.L35]+[.K35]) -> 58.03 | R35: Y | S35: of:=IF([.R35]="Y"; 0; [.Q35]) -> 0
B36: Light up Arcade button | C36: Arcade World UK | D36: AWUK | E36: http://www.arcadeworlduk.com/products/square-44mm-low-profile-illuminated-arcade-button.html | F36: SW1/D1 | G36: Square 44mm Low profile Illuminated arcade button | H36: 0.8 | I36: 4 | K36: 14 | L36: 0 | M36: of:=([.L36]+[.K36])/[.I36] -> 3.5 | N36: of:=[.M36]*[.H36] -> 2.8 | O36: of:=ROUNDUP([.$H$1]*[.H36]/[.I36]) -> 1 | P36: of:=([.I36]*[.O36])-([.H36]*[.$H$1]) -> 0.8 | Q36: of:=[.O36]*([.L36]+[.K36]) -> 14 | R36: Y | S36: of:=IF([.R36]="Y"; 0; [.Q36]) -> 0